repo,category,subcat,stars,star_1d,star_1d_pct,star_7d,star_7d_pct,forks,description,top_devs,contributors,created_at,updated_at,downloads*
OpenNMT/CTranslate2,Model development,Inference optimization,3289,3,0.09%,20,0.61%,288,Fast inference engine for Transformer models,"guillaumekln, minhthuc2502, vince62s",48,2019-09-23,2024-10-10,0
openai/human-eval,AI engineering,Evals,2355,3,0.13%,14,0.59%,334,"Code for the paper ""Evaluating Large Language Models Trained on Code""","heewooj, qimingyuan, Linyxus",3,2021-07-06,2021-11-30,0
NVIDIA/NeMo-Guardrails,AI engineering,Evals,4057,3,0.07%,21,0.52%,372,NeMo Guardrails is an open-source toolkit for easily adding programmable guardrails to LLM-based conversational systems.,"drazvan, schuellc-nvidia, abhijitpal1247",59,2023-04-18,2024-10-04,0
kantord/SeaGOAT,Applications,Coding,973,3,0.31%,5,0.51%,63,local-first semantic code search engine,"kantord, photonbit, eltociear",19,2023-06-20,2024-10-10,0
VainF/Torch-Pruning,Model development,Inference optimization,2647,3,0.11%,13,0.49%,329,[CVPR 2023] DepGraph: Towards Any Structural Pruning,"VainF, Hyunseok-Kim0, HollyLee2000",17,2019-12-15,2024-09-27,252
allenai/OLMo,Model repo,,4499,3,0.07%,22,0.49%,453,"Modeling, training, eval, and inference code for OLMo","epwalsh, dirkgr, 2015aroras",39,2023-02-20,2024-10-03,45
baaivision/EVA,Model repo,Multimodal,2252,3,0.13%,11,0.49%,165,EVA Series: Visual Representation Fantasies from BAAI,"Yuxin-CV, Quan-Sun, caoyue10",10,2022-11-14,2024-08-01,0
evidentlyai/evidently,Infrastructure,Monitoring,5221,3,0.06%,25,0.48%,590,"Evidently is ​​an open-source ML and LLM observability framework. Evaluate, test, and monitor any AI-powered system or data pipeline. From tabular data to Gen AI. 100+ metrics.","elenasamuylova, emeli-dral, Liraim",65,2020-11-25,2024-10-05,53
MetaGLM/FinGLM,Model repo,,1732,3,0.17%,8,0.46%,259,FinGLM: 致力于构建一个开放的、公益的、持久的金融大模型项目，利用开源开放来促进「AI+金融」。,"jiawei243, dictmap, JamePeng",5,2023-09-25,2023-11-17,0
reorproject/reor,Applications,Writing,6957,3,0.04%,32,0.46%,428,Private & local AI personal knowledge management app.,"samlhuillier, chuyouchia, joseplayero",22,2023-11-27,2024-10-08,14543
lucidrains/x-transformers,Model repo,,4641,3,0.06%,21,0.45%,397,A concise but complete full-attention transformer with a set of promising experimental features from various papers,"lucidrains, gurvindersingh, jbcdnr",22,2020-10-24,2024-08-12,0
OpenBMB/AgentVerse,AI engineering,Agent,4096,3,0.07%,18,0.44%,392,"🤖 AgentVerse 🪐 is designed to facilitate the deployment of multiple LLM-based agents in various applications, which primarily provides two frameworks: task-solving and simulation","chenweize1998, yushengsu-thu, chanchimin",22,2023-05-06,2024-04-25,0
wangzhaode/mnn-llm,Infrastructure,Toolings,1439,3,0.21%,6,0.42%,159,llm deploy project based mnn.,"wangzhaode, WhisperChi, kekxv",10,2023-03-17,2024-09-27,55541
Tencent/MedicalNet,Model development,Dataset engineering,1928,3,0.16%,8,0.41%,414,Many studies have shown that the performance on deep learning is significantly affected by volume of training data. The MedicalNet project provides a series of 3D-ResNet pre-trained models and relative code.,cshwhale,1,2019-07-17,1000-01-01,0
pyro-ppl/numpyro,Model development,Modeling & training,2154,3,0.14%,8,0.37%,236,Probabilistic programming with NumPy powered by JAX for autograd and JIT compilation to GPU/TPU/CPU.,"fehiepsi, neerajprad, martinjankowiak",100+,2019-02-13,2024-10-09,0
josStorer/RWKV-Runner,AI engineering,AIE framework,5120,3,0.06%,19,0.37%,486,"A RWKV management and startup tool, full automation, only 8MB. And provides an interface compatible with the OpenAI API. RWKV is a large language model that is fully open source and available for commercial use.","josStorer, eltociear, LonghronShen",10,2023-05-05,2024-09-14,35659
google-deepmind/materials_discovery,Model repo,Multimodal,875,3,0.34%,3,0.34%,138,,amilmerchant,1,2023-11-28,1000-01-01,0
THUDM/AgentBench,AI engineering,Evals,2152,3,0.14%,7,0.33%,150,A Comprehensive Benchmark to Evaluate LLMs as Agents (ICLR'24),"HenryCai11, Longin-Yu, zhc7",10,2023-07-28,2024-08-13,0
yihong0618/xiaogpt,AI engineering,AI interface,6166,3,0.05%,20,0.32%,864,Play ChatGPT and other LLM with Xiaomi AI Speaker,"yihong0618, frostming, pjq",45,2023-02-16,2024-09-22,0
lavague-ai/LaVague,Applications,Workflow automation,5369,3,0.06%,16,0.30%,487,Large Action Model framework to develop AI Web Agents,"lyie28, JoFrost, mbrunel",24,2024-02-26,2024-10-04,0
facebookresearch/xformers,Model development,Modeling & training,8460,3,0.04%,25,0.30%,602,"Hackable and optimized Transformers building blocks, supporting a composable construction.","blefaudeux, danthe3rd, bottler",85,2021-10-13,2024-09-20,0
sqlchat/sqlchat,Applications,Coding,4552,3,0.07%,13,0.29%,409,Chat-based SQL Client and Editor for the next decade,"boojack, tianzhou, CorrectRoadH",12,2023-03-16,2024-06-07,0
Maartengr/BERTopic,Model development,Modeling & training,6052,3,0.05%,17,0.28%,756,Leveraging BERT and c-TF-IDF to create easily interpretable topics. ,"MaartenGr, afuetterer, freddyheppell",75,2020-09-22,2024-10-09,0
EleutherAI/pythia,Model repo,,2235,3,0.13%,6,0.27%,167,The hub for EleutherAI's work on interpretability and learning dynamics,"haileyschoelkopf, StellaAthena, lintangsutawika",17,2021-12-25,2024-05-01,0
apple/ml-stable-diffusion,Model repo,,16778,3,0.02%,43,0.26%,933,Stable Diffusion with Core ML on Apple Silicon,"atiorh, TobyRoseman, pcuenca",34,2022-11-16,2024-10-08,0
1rgs/jsonformer,AI engineering,Prompt engineering,4405,3,0.07%,11,0.25%,154,A Bulletproof Way to Generate Structured JSON from Language Models,"1rgs, danielcorin, ishmandoo",6,2023-04-29,2023-05-30,0
labmlai/labml,Infrastructure,Monitoring,2024,3,0.15%,5,0.25%,135,🔎 Monitor deep learning model training and hardware usage from your mobile phone 📱,"vpj, lakshith-403, hnipun",8,2018-11-16,2024-09-03,0
civitai/civitai,AI engineering,Prompt engineering,6136,3,0.05%,15,0.24%,602,"A repository of models, textual inversions, and more","JustMaier, bkdiehl, lrojas94",26,2022-10-11,2024-10-10,0
Nutlope/roomGPT,Applications,Image production,9951,3,0.03%,23,0.23%,1332,Upload a photo of your room to generate your dream room with AI.,"Nutlope, ljwagerfield, Nick-h4ck3r",6,2023-02-21,2023-09-20,0
erikbern/ann-benchmarks,AI engineering,Evals,4892,3,0.06%,11,0.22%,737,Benchmarks of approximate nearest neighbor libraries in Python,"erikbern, maumueller, ale-f",74,2015-05-28,2023-04-17,0
facebookresearch/seamless_communication,Model repo,Multimodal,10829,3,0.03%,24,0.22%,1056,Foundational Models for State-of-the-Art Speech and Text Translation,"cndn, kauterry, mavlyutovr",35,2023-08-01,2024-08-15,0
mlfoundations/open_flamingo,Model development,Modeling & training,3690,3,0.08%,8,0.22%,280,An open-source framework for training large multimodal models.,"anas-awadalla, jpgard, i-gao",19,2022-10-20,2023-12-02,0
deepseek-ai/DeepSeek-LLM,Model repo,,1410,3,0.21%,3,0.21%,92,DeepSeek LLM: Let there be answers,"DeepSeekPH, stack-heap-overflow, zdaxie",7,2023-11-29,2024-02-04,0
wgwang/LLMs-In-China,Lists,,5350,3,0.06%,11,0.21%,440,中国大模型,"wgwang, shizhediao, liyaooi",7,2023-05-22,2024-05-15,0
TheRamU/Fay,AI engineering,AI interface,8968,3,0.03%,18,0.20%,1769,"Fay is an open-source digital human framework integrating language models and digital characters. It offers retail, assistant, and agent versions for diverse applications like virtual shopping guides, broadcasters, assistants, waiters, teachers, and voice or text-based mobile assistants.","xszyou, wangzai23333, TheRamU",4,2022-06-13,2024-04-19,0
microsoft/DeepSpeedExamples,Tutorials,,6028,3,0.05%,11,0.18%,1023,Example models using DeepSpeed,"lekurile, jeffra, awan-10",72,2020-01-29,2024-09-17,0
iterative/dvc,Infrastructure,Toolings,13687,3,0.02%,19,0.14%,1178,🦉 ML Experiments and Data Management with Git,"efiop, skshetry, pmrowla",100+,2017-03-04,2024-10-08,296166
microsoft/promptbase,Tutorials,Prompt engineering,5375,3,0.06%,7,0.13%,298,All things prompt engineering,"riedgar-ms, Harsha-Nori, microsoftopensource",7,2023-12-12,2024-06-04,0
gpuweb/gpuweb,Infrastructure,Compute management,4782,3,0.06%,6,0.13%,318,Where the GPU for the Web work happens!,"kainino0x, dneto0, toji",100+,2017-02-10,2024-10-09,0
baaivision/Painter,Model repo,,2506,3,0.12%,3,0.12%,167,Painter & SegGPT Series: Vision Foundation Models from BAAI,"WXinlong, zhangxiaosong18, caoyue10",4,2022-12-05,2023-07-06,0
TaskingAI/TaskingAI,AI engineering,AIE framework,6077,3,0.05%,7,0.12%,302,The open source platform for AI-native application development.,"jameszyao, LinkW77, taskingaiwww",17,2024-01-08,2024-10-10,0
LC1332/Luotuo-Chinese-LLM,Model repo,Multilingual,3635,3,0.08%,4,0.11%,246,骆驼(Luotuo): Open Sourced Chinese Language Models. Developed by 陈启源 @ 华中师范大学 & 李鲁鲁 @ 商汤科技 & 冷子昂 @ 商汤科技,"LC1332, qychen2001, SirlyDreamer",5,2023-03-21,2023-05-10,0
JushBJJ/Mr.-Ranedeer-AI-Tutor,Applications,Education,28627,3,0.01%,30,0.10%,3290,A GPT-4 AI Tutor Prompt for customizable personalized learning experiences.,"JushBJJ, angelkurten, Livshitz",12,2023-03-31,2023-11-09,1864
zhayujie/bot-on-anything,AI engineering,AI interface,3910,3,0.08%,4,0.10%,911,"Connect AI models (like ChatGPT-3.5/4.0, Baidu Yiyan, New Bing, Bard) to apps (like Wechat, public account, DingTalk, Telegram,  QQ).  将 ChatGPT、必应、文心一言、谷歌Bard 等对话模型连接各类应用，如微信、公众号、QQ、Telegram、Gmail、Slack、Web、企业微信、飞书、钉钉等。","zhayujie, RegimenArsenic, mouyong",21,2023-02-09,2024-08-24,0
jina-ai/jina,Infrastructure,Toolings,21022,3,0.01%,21,0.10%,2215,☁️ Build multimodal AI applications with cloud-native stack,"hanxiao, JoanFM, nan-wang",100+,2020-02-13,2024-10-01,0
kubeflow/kubeflow,Infrastructure,Compute management,14253,3,0.02%,14,0.10%,2396,Machine Learning Toolkit for Kubernetes,"jlewi, kunmingg, lluunn",100+,2017-11-30,2024-10-02,79387
imoneoi/openchat,Model repo,,5236,3,0.06%,5,0.10%,400,OpenChat: Advancing Open-source Language Models with Imperfect Data,"imoneoi, AdaCheng, alpayariyak",15,2023-05-25,2024-05-24,0
Stability-AI/StableStudio,Applications,Image production,8718,3,0.03%,7,0.08%,866,Community interface for generative AI,"cruhl, jtydhr88, KAJdev",6,2023-04-21,2023-05-24,432
lucidrains/DALLE2-pytorch,Model repo,,11090,3,0.03%,8,0.07%,1087,"Implementation of DALL-E 2, OpenAI's updated text-to-image synthesis neural network,  in Pytorch","lucidrains, nousr, Veldrovive",17,2022-04-07,2023-10-04,0
AIGC-Audio/AudioGPT,Model repo,,9995,3,0.03%,7,0.07%,858,"AudioGPT: Understanding and Generating Speech, Music, Sound, and Talking Head","lmzjms, Rongjiehuang, PeppaPiggeee",11,2023-03-16,2023-05-05,0
BloopAI/bloop,Applications,Coding,9416,3,0.03%,4,0.04%,573,bloop is a fast code search engine written in Rust.,"anastasiya1155, ggordonhall, rsdy",27,2022-12-10,2024-05-23,41678
sfyc23/EverydayWechat,Applications,Bots,9984,3,0.03%,4,0.04%,2313,微信助手：1.每日定时给好友（女友）发送定制消息。2.机器人自动回复好友。3.群助手功能（例如：查询垃圾分类、天气、日历、电影实时票房、快递物流、PM2.5等）,"sfyc23, yaochaorui, L1cardo",13,2019-03-11,2019-12-14,0
interstellard/chatgpt-advanced,Applications,Bots,6442,3,0.05%,2,0.03%,838,WebChatGPT: A browser extension that augments your ChatGPT prompts with web results.,"qunash, thefourcraft, okkidwi",14,2022-12-03,2023-05-08,2657
openai/DALL-E,Model repo,Multimodal,10778,3,0.03%,3,0.03%,1939,PyTorch package for the discrete VAE used for DALL·E.,adityaramesh,1,2021-02-23,1000-01-01,0
SawyerHood/draw-a-ui,Applications,Coding,13244,3,0.02%,2,0.02%,1588,Draw a mockup and generate html for it,"SawyerHood, shtepcell, 0x-sen",4,2023-11-07,2023-11-13,0
Pythagora-io/pythagora,Applications,Coding,1689,2,0.12%,81,4.80%,88,Generate automated tests for your Node.js app via LLMs without developers having to write a single line of code.,"LeonOstrez, zvone187, pavel-pythagora",6,2023-01-21,2023-10-19,0
guinmoon/LLMFarm,AI engineering,AI interface,1259,2,0.16%,25,1.99%,76,llama and other  large language models on iOS and MacOS offline using GGML library.,guinmoon,1,2023-06-14,1000-01-01,208
Ber666/llm-reasoners,AI engineering,Prompt engineering,1195,2,0.17%,21,1.76%,98,A library for advanced large language model reasoning,"Ber666, Leolty, wu-qing-157",14,2023-06-01,2024-07-24,0
jujumilk3/leaked-system-prompts,AI engineering,Prompt engineering,1063,2,0.19%,17,1.60%,129,Collection of leaked system prompts,"jujumilk3, OneTop4458, wassname",11,2023-05-16,2024-10-03,0
mosaicml/streaming,Infrastructure,Data management,1098,2,0.18%,13,1.18%,137,A Data Streaming Library for Efficient Neural Network Training,"karan6181, knighton, snarayan21",51,2022-06-09,2024-10-08,15
promptfoo/promptfoo,AI engineering,Prompt engineering,4403,2,0.05%,50,1.14%,335,"Test your prompts, agents, and RAGs. Red teaming, pentesting, and vulnerability scanning for LLMs. Compare performance of GPT, Claude, Gemini, Llama, and more. Simple declarative configs with command line and CI/CD integration.","typpo, mldangelo, sklein12",100+,2023-04-28,2024-10-10,77
andreibondarev/langchainrb,AI engineering,AIE framework,1326,2,0.15%,14,1.06%,186,Build LLM-powered applications in Ruby,"andreibondarev, alchaplinsky, rickychilcott",96,2023-04-18,2024-10-10,0
SqueezeAILab/LLMCompiler,AI engineering,AIE framework,1426,2,0.14%,15,1.05%,105,[ICML 2024] LLMCompiler: An LLM Compiler for Parallel Function Calling,"kssteven418, hwchase17, eltociear",4,2023-12-06,2024-07-10,0
OpenGVLab/InternVideo,Model repo,Multimodal,1345,2,0.15%,13,0.97%,85,[ECCV2024] Video Foundation Models & Data for Multimodal Understanding,"shepnerd, yinanhe, Andy1621",16,2022-11-23,2024-09-23,0
OpenGVLab/VisionLLM,Model repo,Multimodal,871,2,0.23%,8,0.92%,23,VisionLLM Series,"czczup, wjn922",2,2023-05-18,1000-01-01,0
roboflow/inference,Infrastructure,Serving,1315,2,0.15%,12,0.91%,117,"A fast, easy-to-use, production-ready inference server for computer vision supporting deployment of many popular model architectures and fine-tuned models.","PawelPeczek-Roboflow, probicheaux, paulguerrie",42,2023-07-31,2024-10-09,0
run-llama/LlamaIndexTS,AI engineering,AIE framework,1823,2,0.11%,16,0.88%,348,LlamaIndex in TypeScript,"yisding, marcusschiesser, himself65",93,2023-06-13,2024-10-10,0
vectara/hallucination-leaderboard,AI engineering,Evals,1188,2,0.17%,10,0.84%,46,Leaderboard Comparing LLM Performance at Producing Hallucinations when Summarizing Short Documents,"simonhughes22, ofermend, mbae26",10,2023-10-31,2024-10-02,0
openai/grade-school-math,AI engineering,Evals,1017,2,0.20%,8,0.79%,147,,"vineetsk10, kcobbe",2,2021-10-20,2021-11-03,0
eric-mitchell/direct-preference-optimization,Model development,Modeling & training,2074,2,0.10%,16,0.77%,170,Reference implementation for DPO (Direct Preference Optimization),eric-mitchell,1,2023-06-22,2023-07-23,0
evalplus/evalplus,AI engineering,Evals,1180,2,0.17%,9,0.76%,102,Rigourous evaluation of LLM-synthesized code - NeurIPS 2023,"ganler, Kristoff-starling, brutalsavage",16,2023-04-15,2024-06-18,2240
leondz/garak,AI engineering,Evals,1332,2,0.15%,10,0.75%,153,LLM vulnerability scanner,"leondz, jmartin-tech, erickgalinkin",23,2023-05-10,2024-10-07,0
mit-han-lab/smoothquant,Model development,Inference optimization,1209,2,0.17%,9,0.74%,139,[ICML 2023] SmoothQuant: Accurate and Efficient Post-Training Quantization for Large Language Models,"Guangxuan-Xiao, tonylins, songhan",3,2022-11-17,2023-02-10,0
webdataset/webdataset,Infrastructure,Data management,2251,2,0.09%,16,0.71%,178,"A high-performance Python-based I/O system for large (and small) deep learning problems, with strong support for PyTorch.","tmbdev, tmbnv, jacobbieker",41,2019-08-07,2024-09-27,0
3DTopia/LGM,Model repo,Multimodal,1601,2,0.12%,11,0.69%,105,[ECCV 2024 Oral] LGM: Large Multi-View Gaussian Model for High-Resolution 3D Content Creation.,"ashawkey, brentyi, laz-kaedim",3,2024-02-06,2024-02-29,0
BAAI-Agents/Cradle,Applications,Workflow automation,1767,2,0.11%,12,0.68%,155,"The Cradle framework is a first attempt at General Computer Control (GCC). Cradle supports agents to ace any computer task by enabling strong reasoning abilities, self-improvment, and skill curation, in a standardized general environment with minimal requirements.","DVampire, tellarin, XinrunXu",7,2024-03-03,2024-09-19,0
tensorchord/Awesome-LLMOps,Lists,,3834,2,0.05%,26,0.68%,365,An awesome & curated list of best LLMOps tools for developers,"gaocegege, WarrenWen666, NeroHin",83,2022-04-15,2024-10-10,0
hao-ai-lab/LookaheadDecoding,Model development,Inference optimization,1118,2,0.18%,7,0.63%,66,[ICML 2024] Break the Sequential Dependency of LLM Inference Using Lookahead Decoding,"Viol2000, jiqing-feng, zhisbug",5,2023-11-21,2024-02-14,0
jackmpcollins/magentic,AI engineering,Prompt engineering,1981,2,0.10%,12,0.61%,96,Seamlessly integrate LLMs as Python functions,"jackmpcollins, entropi, eltociear",8,2023-06-18,2024-09-24,0
danswer-ai/danswer,Applications,Info aggregation,10432,2,0.02%,63,0.60%,1257,Gen-AI Chat for Teams - Think ChatGPT if it had access to your team's unique knowledge.,"Weves, yuhongsun96, pablodanswer",100+,2023-04-27,2024-10-10,0
ashishpatel26/LLM-Finetuning,Tutorials,,2101,2,0.10%,12,0.57%,587,LLM Finetuning with peft,ashishpatel26,1,2023-06-08,1000-01-01,0
vocodedev/vocode-python,AI engineering,AI interface,2839,2,0.07%,16,0.56%,481,🤖 Build voice-based LLM agents. Modular + open source.,"ajar98, Kian1354, HHousen",57,2023-02-24,2024-10-10,0
ELLA-Diffusion/ELLA,Model repo,Multimodal,1066,2,0.19%,6,0.56%,56,ELLA: Equip Diffusion Models with LLM for Enhanced Semantic Alignment,"budui, fangyixiao18, melohux",4,2024-03-07,2024-07-17,0
noahshinn/reflexion,AI engineering,Agent,2346,2,0.09%,13,0.55%,225,[NeurIPS 2023] Reflexion: Language Agents with Verbal Reinforcement Learning,"cassanof, noahshinn, noahshinn024",6,2023-03-22,2023-08-04,0
MzeroMiko/VMamba,Model repo,Multimodal,2080,2,0.10%,11,0.53%,129,VMamba: Visual State Space Models，code is based on mamba,"MzeroMiko, sunsmarterjie, neverbiasu",3,2024-01-11,2024-02-02,4403
salesforce/ALBEF,Model development,Modeling & training,1534,2,0.13%,8,0.52%,195,Code for ALBEF: a new vision-language pre-training method,"LiJunnan1992, chenxwh, svc-scm",3,2021-07-13,2022-03-21,0
hendrycks/test,AI engineering,Evals,1172,2,0.17%,6,0.51%,90,Measuring Massive Multitask Language Understanding | ICLR 2021,"hendrycks, Helw150, xksteven",5,2020-09-07,2023-04-24,0
mattzcarey/code-review-gpt,Applications,Coding,1564,2,0.13%,8,0.51%,156,"Code review powered by LLMs (OpenAI GPT4, Sonnet 3.5) & Embeddings ⚡️ Improve code quality and catch bugs before you break production 🚀 Lives in your Github/GitLab/Azure DevOps CI","lizacullis, SEBRATHEZEBRA, mattzcarey",25,2023-07-06,2024-09-03,0
RayVentura/ShortGPT,Applications,Video production,5655,2,0.04%,28,0.50%,713,🚀🎬 ShortGPT - Experimental AI framework for youtube shorts / tiktok channel automation,"RayVentura, transonit, test12376",11,2023-06-27,2024-02-11,0
ianarawjo/ChainForge,AI engineering,Prompt engineering,2240,2,0.09%,11,0.49%,174,An open-source visual programming environment for battle-testing prompts to LLMs.,"ianarawjo, priyanmuthu, eglassman",7,2023-03-26,2024-08-12,0
gptscript-ai/gptscript,Applications,Coding,2996,2,0.07%,13,0.43%,263,Build AI assistants that interact with your systems,"ibuildthecloud, thedadams, g-linville",30,2024-01-29,2024-02-13,3584
state-spaces/s4,Model repo,,2403,2,0.08%,10,0.42%,287,Structured state space sequence models,"albertfgu, krandiash, ad12",8,2021-11-03,2023-07-11,0
SHI-Labs/OneFormer,Model repo,,1458,2,0.14%,6,0.41%,129,"OneFormer: One Transformer to Rule Universal Image Segmentation, arxiv 2022 / CVPR 2023","praeclarumjj3, honghuis, alihassanijr",5,2022-11-02,2023-04-18,0
time-series-foundation-models/lag-llama,Model repo,,1221,2,0.16%,5,0.41%,149,Lag-Llama: Towards Foundation Models for Probabilistic Time Series Forecasting,"ashok-arjun, kashif, araghukas",5,2024-02-07,2024-09-08,0
lk-geimfari/mimesis,AI engineering,Dataset engineering,4418,2,0.05%,18,0.41%,335,Mimesis is a robust data generator for Python that can produce a wide range of fake data in multiple languages.,"lk-geimfari, dependabot-preview[bot], sobolevn",100+,2016-09-09,2024-09-23,635
shibing624/MedicalGPT,Model development,Modeling & training,3257,2,0.06%,13,0.40%,492,MedicalGPT: Training Your Own Medical GPT Model with ChatGPT Training Pipeline. 训练医疗大模型，实现了包括增量预训练(PT)、有监督微调(SFT)、RLHF、DPO、ORPO。,"shibing624, ZhuangXialie, princepride",10,2023-06-02,2024-08-25,0
huggingface/autotrain-advanced,Model development,Modeling & training,3848,2,0.05%,15,0.39%,471,🤗 AutoTrain Advanced,"abhishekkrthakur, SBrandeis, liveaverage",22,2020-12-15,2024-10-04,0
di-sukharev/opencommit,Applications,Coding,6008,2,0.03%,23,0.38%,320,Generate conventional git commit messages with AI in 1 second 🤯🔫,"di-sukharev, matscube, JMN09",70,2023-03-06,2024-09-06,0
salesforce/BLIP,Model repo,Multimodal,4713,2,0.04%,18,0.38%,625,PyTorch code for BLIP: Bootstrapping Language-Image Pre-training for Unified Vision-Language Understanding and Generation  ,AK391,1,2022-01-25,2022-02-08,0
anthropics/hh-rlhf,Model development,Dataset engineering,1580,2,0.13%,6,0.38%,122,"Human preference data for ""Training a Helpful and Harmless Assistant with Reinforcement Learning from Human Feedback""","8enmann, dganguli, NinoRisteski",4,2022-04-10,2023-09-19,0
protectai/rebuff,AI engineering,Prompt engineering,1088,2,0.18%,4,0.37%,80,LLM Prompt Injection Detector,"woop, shrumm, seanpmorgan",9,2023-04-24,2024-01-25,0
intel-analytics/BigDL,Model development,Inference optimization,6574,2,0.03%,24,0.37%,1254,"Accelerate local LLM inference and finetuning (LLaMA, Mistral, ChatGLM, Qwen, Baichuan, Mixtral, Gemma, Phi, MiniCPM, etc.) on Intel XPU (e.g., local PC with iGPU and NPU, discrete GPU such as Arc, Flex and Max); seamlessly integrate with llama.cpp, Ollama, HuggingFace, LangChain, LlamaIndex, GraphRAG, DeepSpeed, vLLM, FastChat, Axolotl, etc.","Oscilloscope98, MeouSker77, rnwang04",100+,2016-08-29,2024-10-10,57
intel-analytics/ipex-llm,Model development,Inference optimization,6574,2,0.03%,24,0.37%,1254,"Accelerate local LLM inference and finetuning (LLaMA, Mistral, ChatGLM, Qwen, Baichuan, Mixtral, Gemma, Phi, MiniCPM, etc.) on Intel XPU (e.g., local PC with iGPU and NPU, discrete GPU such as Arc, Flex and Max); seamlessly integrate with llama.cpp, Ollama, HuggingFace, LangChain, LlamaIndex, GraphRAG, DeepSpeed, vLLM, FastChat, Axolotl, etc.","Oscilloscope98, MeouSker77, rnwang04",100+,2016-08-29,2024-10-10,340
fchollet/ARC,AI engineering,Evals,3371,2,0.06%,12,0.36%,562,The Abstraction and Reasoning Corpus,"fchollet, ageron, kaalam",21,2019-11-05,2024-06-19,0
open-mmlab/mmdeploy,Infrastructure,Serving,2739,2,0.07%,9,0.33%,627,OpenMMLab Model Deployment Framework,"RunningLeon, AllentDan, grimoire",100+,2021-12-24,2024-09-30,34202
turboderp/exllama,Model development,Inference optimization,2752,2,0.07%,9,0.33%,215,A more memory-efficient rewrite of the HF transformers implementation of Llama for use with quantized weights.,"turboderp, QuarticCat, Kerushii",15,2023-05-04,2023-09-11,0
microsoft/PromptCraft-Robotics,AI engineering,Prompt engineering,1855,2,0.11%,6,0.32%,201,Community for applying LLMs to robotics and a robot simulator with ChatGPT integration,"yuan-alex, rogeriobonatti, saihv",3,2023-02-08,2023-03-17,847
TimDettmers/bitsandbytes,Model development,Inference optimization,6146,2,0.03%,19,0.31%,617,Accessible large language models via k-bit quantization for PyTorch.,"TimDettmers, Titus-von-Koeller, justheuristic",78,2021-06-04,2024-09-30,5373
MineDojo/Voyager,Applications,Bots,5543,2,0.04%,17,0.31%,514,An Open-Ended Embodied Agent with Large Language Models,"xieleo5, cmaranes, FOLLGAD",12,2023-05-25,2023-07-27,0
YiVal/YiVal,AI engineering,Prompt engineering,2641,2,0.08%,8,0.30%,427,Your Automatic Prompt Engineering Assistant for GenAI Applications,"yje-arch, crazycth, uni-zhuan",44,2023-07-15,2024-02-06,0
mosaicml/llm-foundry,Model development,Modeling & training,4001,2,0.05%,12,0.30%,524,LLM training code for Databricks foundation models,"dakinggg, vchiley, abhi-mosaic",90,2023-04-28,2024-10-09,0
FreedomIntelligence/Medical_NLP,Lists,,2104,2,0.10%,6,0.29%,402,"Medical NLP Competition, dataset, large models, paper","lrs1353281004, wangxidong06, RobinLin2002",7,2019-11-14,2024-06-07,0
unum-cloud/usearch,Infrastructure,VectorDB,2155,2,0.09%,6,0.28%,131,"Fast Open-Source Search & Clustering engine × for Vectors & 🔜 Strings × in C++, C, Python, JavaScript, Rust, Java, Objective-C, Swift, C#, GoLang, and Wolfram 🔍","ashvardanian, gurgenyegoryan, mgevor",53,2023-02-22,2024-10-10,1369
Mooler0410/LLMsPracticalGuide,Tutorials,,9363,2,0.02%,26,0.28%,716,"A curated list of practical guide resources of LLMs (LLMs Tree, Examples, Papers)","Mooler0410, JingfengYang, trx14",13,2023-04-23,2023-08-06,0
DSXiangLi/DecryptPrompt,Lists,,2615,2,0.08%,7,0.27%,265,总结Prompt&LLM论文，开源数据&模型，AIGC应用,"DSXiangLi, gordonhu608, aFlyBird0",5,2023-02-10,2023-12-18,0
OpenGVLab/Ask-Anything,Model repo,Multimodal,3014,2,0.07%,8,0.27%,248,"[CVPR2024 Highlight][VideoChatGPT] ChatGPT with video understanding! And many more supported LMs such as miniGPT4, StableLM, and MOSS.","yinanhe, Andy1621, shepnerd",11,2023-04-19,2024-04-05,0
georgezouq/awesome-ai-in-finance,Tutorials,,3431,2,0.06%,9,0.26%,416,🔬 A curated list of awesome LLMs & deep learning strategies & tools in financial market.,"georgezouq, anmorgan24, jiminHuang",18,2018-08-29,2024-04-13,0
